{
  "event_id": "7c9e2a10-1111-4b2a-9c33-8a1b2c3d4e5f",
  "event_type": "horizon_breach",
  "assurance_level": "L2",
  "grant_id": "3f2a1c40-0d1e-4b2a-9c33-8a1b2c3d4e5f",
  "record_id": "9d1f2b30-2222-4b2a-9c33-8a1b2c3d4e5f",
  "load_condition": "peak",
  "horizon_committed_ms": 10000,
  "horizon_measured_ms": 14200,
  "exposure_at_risk": { "amount": 1000, "currency": "GBP" },
  "remedy_triggered": true,
  "root_cause": "status-list fetch latency spike under peak load",
  "remediation_ref": "ticket:EXAMPLE-1421",
  "occurred_at": "2026-07-19T09:14:22Z"
}
